{
  "schema_version": "1.0.0",
  "fixture_count": 24,
  "rendering_count": 72,
  "contract": "Every rendering is evaluated against the same authority_input. Tone distinction is required only after canonical equivalence passes.",
  "fixtures": [
    {
      "fixture_id": "fx01_bridge_slip",
      "kid_mode": false,
      "authority_input": {
        "location": "Old Stone Bridge",
        "present_entities": [
          "Mara"
        ],
        "exits": [
          "north bank",
          "south bank"
        ],
        "inventory": [
          "rope",
          "lantern"
        ],
        "hp": 17,
        "state_delta": {
          "hp": -3
        },
        "quest_status": "crossing_open",
        "permit_status": "none",
        "evidence": "The wet parapet and snapped rope",
        "outcome_code": "failed_climb"
      },
      "canonical_sha256": "07a1ac76ad2afa18e2bdfa10d8cfbff0995dd39f5cd8a1f072be4c104278835b",
      "renderings": [
        {
          "tone_id": "grimdark_bleak_consequence",
          "text": "LOCATION: Old Stone Bridge. PRESENT: Mara. EXITS: north bank, south bank. INVENTORY: rope, lantern. HP: 17. OUTCOME: failed_climb. Rain falls; the rope has snapped. The detail lands without mercy, and nothing in the wording changes the cost.",
          "expected_canonical_hash": "07a1ac76ad2afa18e2bdfa10d8cfbff0995dd39f5cd8a1f072be4c104278835b",
          "tone_signals_required": [
            "The detail lands without mercy, and nothing in the wording changes the cost."
          ],
          "kid_safe_required": false
        },
        {
          "tone_id": "warm_chronicle",
          "text": "LOCATION: Old Stone Bridge. PRESENT: Mara. EXITS: north bank, south bank. INVENTORY: rope, lantern. HP: 17. OUTCOME: failed_climb. Rain falls; the rope has snapped. The moment is set down with care, preserving both the cost and the company present.",
          "expected_canonical_hash": "07a1ac76ad2afa18e2bdfa10d8cfbff0995dd39f5cd8a1f072be4c104278835b",
          "tone_signals_required": [
            "The moment is set down with care, preserving both the cost and the company present."
          ],
          "kid_safe_required": false
        },
        {
          "tone_id": "clinical_auditor",
          "text": "LOCATION: Old Stone Bridge. PRESENT: Mara. EXITS: north bank, south bank. INVENTORY: rope, lantern. HP: 17. OUTCOME: failed_climb. Rain falls; the rope has snapped. Observation, transaction, and evidence are separated; no additional cause is inferred.",
          "expected_canonical_hash": "07a1ac76ad2afa18e2bdfa10d8cfbff0995dd39f5cd8a1f072be4c104278835b",
          "tone_signals_required": [
            "Observation, transaction, and evidence are separated; no additional cause is inferred."
          ],
          "kid_safe_required": false
        }
      ],
      "pass_criteria": {
        "render_count_min": 3,
        "canonical_hash_equal": true,
        "numbers_exact": true,
        "rendered_entities_subset_of_present": true,
        "rendered_exits_subset_of_exits": true,
        "no_unearned_inventory_or_status": true,
        "tone_distinct": true,
        "kid_safe_if_tagged": false,
        "no_forbidden_ip_or_style_clone": true
      }
    },
    {
      "fixture_id": "fx02_archive_door",
      "kid_mode": true,
      "authority_input": {
        "location": "Civic Archive",
        "present_entities": [
          "Keeper Sol"
        ],
        "exits": [
          "west stair"
        ],
        "inventory": [
          "brass key"
        ],
        "hp": 20,
        "state_delta": {},
        "quest_status": "records_sealed",
        "permit_status": "archive permit required",
        "evidence": "The lock plate and posted seal",
        "outcome_code": "blocked_entry"
      },
      "canonical_sha256": "332384aa63ddaa6356df40ba88a2dc7b3884fd364bc52516b11da912df681522",
      "renderings": [
        {
          "tone_id": "gothic_moonlit_dread",
          "text": "LOCATION: Civic Archive. PRESENT: Keeper Sol. EXITS: west stair. INVENTORY: brass key. HP: 20. OUTCOME: blocked_entry. Dust hangs in the lamp beam. Light and architecture carry the unease; no unseen presence is implied.",
          "expected_canonical_hash": "332384aa63ddaa6356df40ba88a2dc7b3884fd364bc52516b11da912df681522",
          "tone_signals_required": [
            "Light and architecture carry the unease; no unseen presence is implied."
          ],
          "kid_safe_required": true
        },
        {
          "tone_id": "dry_wit_deadpan",
          "text": "LOCATION: Civic Archive. PRESENT: Keeper Sol. EXITS: west stair. INVENTORY: brass key. HP: 20. OUTCOME: blocked_entry. Dust hangs in the lamp beam. The situation has declined to become more convenient, but the record is clear.",
          "expected_canonical_hash": "332384aa63ddaa6356df40ba88a2dc7b3884fd364bc52516b11da912df681522",
          "tone_signals_required": [
            "The situation has declined to become more convenient, but the record is clear."
          ],
          "kid_safe_required": true
        },
        {
          "tone_id": "kid_plain_stakes",
          "text": "LOCATION: Civic Archive. PRESENT: Keeper Sol. EXITS: west stair. INVENTORY: brass key. HP: 20. OUTCOME: blocked_entry. Dust hangs in the lamp beam. The result is clear, the words are simple, and the next step can be chosen without pressure.",
          "expected_canonical_hash": "332384aa63ddaa6356df40ba88a2dc7b3884fd364bc52516b11da912df681522",
          "tone_signals_required": [
            "The result is clear, the words are simple, and the next step can be chosen without pressure."
          ],
          "kid_safe_required": true
        }
      ],
      "pass_criteria": {
        "render_count_min": 3,
        "canonical_hash_equal": true,
        "numbers_exact": true,
        "rendered_entities_subset_of_present": true,
        "rendered_exits_subset_of_exits": true,
        "no_unearned_inventory_or_status": true,
        "tone_distinct": true,
        "kid_safe_if_tagged": true,
        "no_forbidden_ip_or_style_clone": true
      }
    },
    {
      "fixture_id": "fx03_failed_bargain",
      "kid_mode": false,
      "authority_input": {
        "location": "Glass Market",
        "present_entities": [
          "Ilyra",
          "broker"
        ],
        "exits": [
          "east arcade"
        ],
        "inventory": [
          "sealed letter",
          "12 coins"
        ],
        "hp": 20,
        "state_delta": {
          "coins": 0
        },
        "quest_status": "audience_pending",
        "permit_status": "none",
        "evidence": "The broker’s refusal",
        "outcome_code": "offer_rejected"
      },
      "canonical_sha256": "070215a080e5a8757f4d16382dd237bc5b5b544a7f5743a70b70ef7ef8937a50",
      "renderings": [
        {
          "tone_id": "fae_uncanny_tale",
          "text": "LOCATION: Glass Market. PRESENT: Ilyra, broker. EXITS: east arcade. INVENTORY: sealed letter, 12 coins. HP: 20. OUTCOME: offer_rejected. Reflections cross the glass canopy. The pattern feels uncanny, while every cost and rule stays literal.",
          "expected_canonical_hash": "070215a080e5a8757f4d16382dd237bc5b5b544a7f5743a70b70ef7ef8937a50",
          "tone_signals_required": [
            "The pattern feels uncanny, while every cost and rule stays literal."
          ],
          "kid_safe_required": false
        },
        {
          "tone_id": "noir_case_file",
          "text": "LOCATION: Glass Market. PRESENT: Ilyra, broker. EXITS: east arcade. INVENTORY: sealed letter, 12 coins. HP: 20. OUTCOME: offer_rejected. Reflections cross the glass canopy. The clue is what it is; suspicion does not become proof.",
          "expected_canonical_hash": "070215a080e5a8757f4d16382dd237bc5b5b544a7f5743a70b70ef7ef8937a50",
          "tone_signals_required": [
            "The clue is what it is; suspicion does not become proof."
          ],
          "kid_safe_required": false
        },
        {
          "tone_id": "military_procedural",
          "text": "LOCATION: Glass Market. PRESENT: Ilyra, broker. EXITS: east arcade. INVENTORY: sealed letter, 12 coins. HP: 20. OUTCOME: offer_rejected. Reflections cross the glass canopy. Situation confirmed; constraints and available routes remain as listed.",
          "expected_canonical_hash": "070215a080e5a8757f4d16382dd237bc5b5b544a7f5743a70b70ef7ef8937a50",
          "tone_signals_required": [
            "Situation confirmed; constraints and available routes remain as listed."
          ],
          "kid_safe_required": false
        }
      ],
      "pass_criteria": {
        "render_count_min": 3,
        "canonical_hash_equal": true,
        "numbers_exact": true,
        "rendered_entities_subset_of_present": true,
        "rendered_exits_subset_of_exits": true,
        "no_unearned_inventory_or_status": true,
        "tone_distinct": true,
        "kid_safe_if_tagged": false,
        "no_forbidden_ip_or_style_clone": true
      }
    },
    {
      "fixture_id": "fx04_ration_found",
      "kid_mode": false,
      "authority_input": {
        "location": "Hill Shelter",
        "present_entities": [
          "Toma"
        ],
        "exits": [
          "trail"
        ],
        "inventory": [
          "flint",
          "2 rations"
        ],
        "hp": 20,
        "state_delta": {
          "rations": 2
        },
        "quest_status": "shelter_checked",
        "permit_status": "none",
        "evidence": "The opened supply box",
        "outcome_code": "item_found"
      },
      "canonical_sha256": "27cc0d605cca231170a4df5884785e73deb6038bcdc62490723c4c8520eb78e2",
      "renderings": [
        {
          "tone_id": "cozy_low_stakes_comfort",